Subreddit,Original Title,Title,housing market,housing,property,real estate,construction,building,infrastructure,labor,wages,Created,Match,neg,neu,pos,compound,label
ireland,"Guys, I need to vent about how the Irish economy affects the life of young people in Ireland (well mine mainly). I’m so grateful for what this country does have to offer but I’m genuinely getting tired and frustrated. My rant will mainly be on housing and finance.",guys need vent irish economy affects life young people ireland well mine mainly grateful country offer genuinely getting tired frustrated rant mainly housing finance,0,1,0,0,0,0,0,0,0,2023.0,1.0,0.265,0.579,0.155,-0.5574,neg
ireland,Mary Lou McDonald rejects idea Sinn Féin housing policy prompting landlords to exit market,mary lou mcdonald rejects idea sinn féin housing policy prompting landlords exit market,0,1,0,0,0,0,0,0,0,2023.0,1.0,0.211,0.789,0.0,-0.4939,neg
ireland,Why should we work ?,work,0,0,0,0,0,0,0,0,0,2023.0,,0.0,1.0,0.0,0.0,neu
ireland,"Letter from 7 TDs and 7 Senators doing the usual ""Obviously Russia is bad but we shouldn't help Ukraine defend themselves in any form and Ukraine needs to just shut up and start negotiating with their aggressors"". I look forward to not voting for any of the NUI senators again.",letter 7 tds 7 senators usual obviously russia bad shouldnt help ukraine defend form ukraine needs shut start negotiating aggressors look forward voting nui senators,0,0,0,0,0,0,0,0,0,2023.0,,0.277,0.723,0.0,-0.7689,neg
ireland,"First-time buyers dominate market as average house price exceeds €293,000 - REA | BreakingNews.ie",firsttime buyers dominate market average house price exceeds 293 000 rea breakingnews ie,0,0,0,0,0,0,0,0,0,2023.0,,0.111,0.889,0.0,-0.128,neg
ireland,"46% of people oppose the government’s decision to end the eviction ban. 36% support the decision, 18% don’t know 👀",46 people oppose government decision end eviction ban 36 support decision 18 know,0,0,0,0,0,0,0,0,0,2023.0,,0.342,0.518,0.14,-0.5994,neg
ireland,Family Evicted Despite Council's 'Full Market Value' Offer To Buy House,family evicted despite councils full market value offer buy house,0,0,0,0,0,0,0,0,0,2023.0,,0.0,0.789,0.211,0.34,pos
ireland,Weird goings on in the housing market..,weird goings housing market,1,1,0,0,0,0,0,0,0,2023.0,1.0,0.362,0.638,0.0,-0.1779,neg
ireland,Labour's Legacy from Austerity and Joan the Snark,labours legacy austerity joan snark,0,0,0,0,0,0,0,0,0,2023.0,,0.0,1.0,0.0,0.0,neu
ireland,ELI5: Why would it matter if landlords sold up and exited the rental market?,eli5 would matter landlords sold exited rental market,0,0,0,0,0,0,0,0,0,2023.0,,0.0,0.864,0.136,0.0258,neu
ireland,This is why eating out in ireland drives me crazy,eating ireland drives crazy,0,0,0,0,0,0,0,0,0,2023.0,,0.444,0.556,0.0,-0.34,neg
ireland,Huge swarm of wasps? / bees? landed on the side of the house,huge swarm wasps bees landed side house,0,0,0,0,0,0,0,0,0,2023.0,,0.0,0.723,0.277,0.3182,pos
ireland,"The manager of Magowna House knew for three months that asylum seekers would be housed there. But nobody else was told. Not the local community, not local politicians, not even Clare Immigrant Support Centre. How was this handled so poorly? (Holly Cairns)",manager magowna house knew three months asylum seekers would housed nobody else told local community local politicians even clare immigrant support centre handled poorly holly cairns,0,0,0,0,0,0,0,0,0,2023.0,,0.0,0.903,0.097,0.4019,pos
ireland,"You might think £4975 is a bit steep - but a corner house was £500 more expensive, as you could always build a nice big extension in the side garden.",might think 4975 bit steep corner house 500 expensive could always build nice big extension side garden,0,0,0,0,0,0,0,0,0,2023.0,,0.0,0.851,0.149,0.4215,pos
ireland,What is the point of having a Range Rover in Ireland?,point range rover ireland,0,0,0,0,0,0,0,0,0,2023.0,,0.0,1.0,0.0,0.0,neu
ireland,"Varadkar is hip with the kids, yo",varadkar hip kids yo,0,0,0,0,0,0,0,0,0,2023.0,,0.0,1.0,0.0,0.0,neu
ireland,Do you rinse the soap off your dishes? (Is this an Irish thing??),rinse soap dishes irish thing,0,0,0,0,0,0,0,0,0,2023.0,,0.0,1.0,0.0,0.0,neu
ireland,Found a vape in my 14 year olds room. I don’t vape or smoke. Can’t believe he would even try it. I obviously know that teens try things; but two found in his room. How would you deal with this,found vape 14 year olds room vape smoke believe would even try obviously know teens try things two found room would deal,0,0,0,0,0,0,0,0,0,2023.0,,0.0,1.0,0.0,0.0,neu
ireland,PSA: If you are planning on doing attic converions avoid this company!,psa planning attic converions avoid company,0,0,0,0,0,0,0,0,0,2023.0,,0.306,0.694,0.0,-0.296,neg
ireland,Renting with pets (🐈),renting pets,0,0,0,0,0,0,0,0,0,2023.0,,0.0,1.0,0.0,0.0,neu
ireland,Just got evicted with 5 hours notice.,got evicted 5 hours notice,0,0,0,0,0,0,0,0,0,2023.0,,0.0,1.0,0.0,0.0,neu
ireland,"Out of curiosity, at what age do you feel that purchasing a small one-bedroom flat should become a realistic possibility?",curiosity age feel purchasing small onebedroom flat become realistic possibility,0,0,0,0,0,0,0,0,0,2023.0,,0.0,1.0,0.0,0.0,neu
ireland,"1938, public kissing on church property: Men pay £2, women go to prison for a month.",1938 public kissing church property men pay 2 women go prison month,0,0,1,0,0,0,0,0,0,2023.0,1.0,0.287,0.488,0.226,0.0,neu
ireland,"One of the country's biggest developers blames planning policy for the housing crisis. It's sitting on 5,000 successful applications",one countrys biggest developers blames planning policy housing crisis sitting 5 000 successful applications,0,1,0,0,0,0,0,0,0,2023.0,1.0,0.33,0.485,0.184,-0.4588,neg
ireland,Property firm made €8m leasing homes for use as social housing,property firm made 8m leasing homes use social housing,0,1,1,0,0,0,0,0,0,2023.0,1.0,0.0,1.0,0.0,0.0,neu
ireland,"€1,020 a month and not even allowed to boom boom?",1 020 month even allowed boom boom,0,0,0,0,0,0,0,0,0,2023.0,,0.0,1.0,0.0,0.0,neu
ireland,More than 15 abandoned houses in Kildare County Council property in a single neighbourhood,15 abandoned houses kildare county council property single neighbourhood,0,0,1,0,0,0,0,0,0,2023.0,1.0,0.273,0.727,0.0,-0.4588,neg
ireland,Irish Salary Transparency Thread! Seen this on a subreddit from Chicago.,irish salary transparency thread seen subreddit chicago,0,0,0,0,0,0,0,0,0,2023.0,,0.0,1.0,0.0,0.0,neu
ireland,"I’m moving out of my apartment soon but I unfortunately live with a lazy prick who has the place in a heap. I refuse to clean up after him and have notified landlord of the damage he’s doing on more than one occasion. I’m still concerned they will try withhold my deposit, is there anything I can do?",moving apartment soon unfortunately live lazy prick place heap refuse clean notified landlord damage one occasion still concerned try withhold deposit anything,0,0,0,0,0,0,0,0,0,2023.0,,0.404,0.51,0.086,-0.8402,neg
ireland,Thrilled to have this lad (common buzzard) around the property. Keeps the rats and mice in check.,thrilled lad common buzzard around property keeps rats mice check,0,0,1,0,0,0,0,0,0,2023.0,1.0,0.0,0.756,0.244,0.4404,pos
ireland,Pressure building to get employees back to the office more of the time,pressure building get employees back office time,0,0,0,0,0,1,0,0,0,2023.0,1.0,0.268,0.732,0.0,-0.296,neg
ireland,Some very very disappointing attitudes expressed towards the working class in this sub given all the prior chat about the East Wall protests.,disappointing attitudes expressed towards working class sub given prior chat east wall protests,0,0,0,0,0,0,0,0,0,2023.0,,0.317,0.683,0.0,-0.6249,neg
ireland,Irish Famine Memorial in Tribeca,irish famine memorial tribeca,0,0,0,0,0,0,0,0,0,2023.0,,0.0,1.0,0.0,0.0,neu
ireland,Scaling back the Russian Embassy in Dublin,scaling back russian embassy dublin,0,0,0,0,0,0,0,0,0,2023.0,,0.0,1.0,0.0,0.0,neu
ireland,"Looking at leasing out a property, first time landlord - does anyone use a real estate agent to manage their property? Pros Vs cons",looking leasing property first time landlord anyone use real estate agent manage property pros vs cons,0,0,1,1,0,0,0,0,0,2023.0,1.0,0.0,1.0,0.0,0.0,neu
ireland,Question regarding buying land and planning permission,question regarding buying land planning permission,0,0,0,0,0,0,0,0,0,2023.0,,0.0,1.0,0.0,0.0,neu
ireland,What Davy real estate want to do to Stephen's green shopping centre,davy real estate want stephens green shopping centre,0,0,0,1,0,0,0,0,0,2022.0,1.0,0.0,0.843,0.157,0.0772,pos
ireland,Step by Step Guide to the Biggest Scam in National History.,step step guide biggest scam national history,0,0,0,0,0,0,0,0,0,2022.0,,0.381,0.619,0.0,-0.5719,neg
ireland,Please tell me this is illegal? What can we do to punish this landlord?,please tell illegal punish landlord,0,0,0,0,0,0,0,0,0,2022.0,,0.619,0.177,0.204,-0.6908,neg
ireland,Deposit not on contract,deposit contract,0,0,0,0,0,0,0,0,0,2023.0,,0.0,1.0,0.0,0.0,neu
ireland,How to get a *decent* job?,get decent job,0,0,0,0,0,0,0,0,0,2023.0,,0.0,1.0,0.0,0.0,neu
ireland,6 days off Twitter,6 days twitter,0,0,0,0,0,0,0,0,0,2023.0,,0.0,1.0,0.0,0.0,neu
ireland,Corkman that emigrated to Canada for 11 years resents the Irish government helping refugees 🤔,corkman emigrated canada 11 years resents irish government helping refugees,0,0,0,0,0,0,0,0,0,2023.0,,0.177,0.645,0.177,0.0,neu
ireland,"You wake up tomorrow at 31 and you’re unemployed with no degree. After doing a year of therapy and self work, you decide you want to pursue an education/career that will earn you a decent wage. What are you doing?",wake tomorrow 31 unemployed degree year therapy self work decide want pursue education career earn decent wage,0,0,0,0,0,0,0,0,0,2023.0,,0.0,0.925,0.075,0.0772,pos
ireland,"National Children’s Hospital will not open until 2025, doctors told",national children hospital open 2025 doctors told,0,0,0,0,0,0,0,0,0,2023.0,,0.0,1.0,0.0,0.0,neu
ireland,Why should we work ?,work,0,0,0,0,0,0,0,0,0,2023.0,,0.0,1.0,0.0,0.0,neu
ireland,Jail for construction worker caught with €1k of drugs in his home,jail construction worker caught 1k drugs home,0,0,0,0,1,0,0,0,0,2023.0,1.0,0.0,1.0,0.0,0.0,neu
ireland,Does anyone know what this symbol is?,anyone know symbol,0,0,0,0,0,0,0,0,0,2023.0,,0.0,1.0,0.0,0.0,neu
ireland,"Leaving cert papers from 1925, different questions for boys and girls for the same test",leaving cert papers 1925 different questions boys girls test,0,0,0,0,0,0,0,0,0,2023.0,,0.0,1.0,0.0,0.0,neu
ireland,Apartment block management company seem to renting all parking spots to people not living in the building. Can anything be done about this?,apartment block management company seem renting parking spots people living building anything done,0,0,0,0,0,1,0,0,0,2023.0,1.0,0.195,0.805,0.0,-0.4404,neg
ireland,Lads and Ladettes. I built the Spanish Armada ships that sunk in Streedagh Sligo. Its going into a MUSEUM !,lads ladettes built spanish armada ships sunk streedagh sligo going museum,0,0,0,0,0,0,0,0,0,2023.0,,0.0,1.0,0.0,0.0,neu
ireland,"You might think £4975 is a bit steep - but a corner house was £500 more expensive, as you could always build a nice big extension in the side garden.",might think 4975 bit steep corner house 500 expensive could always build nice big extension side garden,0,0,0,0,0,0,0,0,0,2023.0,,0.0,0.851,0.149,0.4215,pos
ireland,whats your story of interactions with cults in Ireland?,whats story interactions cults ireland,0,0,0,0,0,0,0,0,0,2023.0,,0.0,1.0,0.0,0.0,neu
ireland,Pressure building to get employees back to the office more of the time,pressure building get employees back office time,0,0,0,0,0,1,0,0,0,2023.0,1.0,0.268,0.732,0.0,-0.296,neg
ireland,Buried car found in the sittingroom of a house getting pyrite issues fixed in Blanchardstown.,buried car found sittingroom house getting pyrite issues fixed blanchardstown,0,0,0,0,0,0,0,0,0,2023.0,,0.0,1.0,0.0,0.0,neu
ireland,"""The RHL has now found safe and secure accommodation for the homeless asylum seekers who had been camping at Sandwith Street in Dublin 2. To do so, the RHL have opened a long vacant building in Dublin City and moved these vulnerable people in. 1)"" - Revolutionary Housing League",rhl found safe secure accommodation homeless asylum seekers camping sandwith street dublin 2 rhl opened long vacant building dublin city moved vulnerable people 1 revolutionary housing league,0,1,0,0,0,1,0,0,0,2023.0,1.0,0.065,0.753,0.182,0.5267,pos
ireland,"One of the country's biggest developers blames planning policy for the housing crisis. It's sitting on 5,000 successful applications",one countrys biggest developers blames planning policy housing crisis sitting 5 000 successful applications,0,1,0,0,0,0,0,0,0,2023.0,1.0,0.33,0.485,0.184,-0.4588,neg
ireland,Looking for the opinions of irish mothers and fathers/ anyone 40-65,looking opinions irish mothers fathers anyone 4065,0,0,0,0,0,0,0,0,0,2023.0,,0.0,1.0,0.0,0.0,neu
ireland,"Just got a quote of €15,000 from Eir to move a single telephone pole",got quote 15 000 eir move single telephone pole,0,0,0,0,0,0,0,0,0,2023.0,,0.0,1.0,0.0,0.0,neu
ireland,Man (61) faces eviction after tenancies board rules in his favour over gas charges dispute,man 61 faces eviction tenancies board rules favour gas charges dispute,0,0,0,0,0,0,0,0,0,2023.0,,0.441,0.395,0.164,-0.5994,neg
ireland,"As bad as Dublin? In Berlin’s broken rental market, 200 people apply for one apartment",bad dublin berlin broken rental market 200 people apply one apartment,0,0,0,0,0,0,0,0,0,2023.0,,0.423,0.577,0.0,-0.765,neg
ireland,Public Transport: Democratically Dogshite,public transport democratically dogshite,0,0,0,0,0,0,0,0,0,2023.0,,0.0,1.0,0.0,0.0,neu
ireland,‘The level of anxiety we’re facing in schools is unprecedented’,level anxiety facing schools unprecedented,0,0,0,0,0,0,0,0,0,2023.0,,0.298,0.702,0.0,-0.1779,neg
ireland,Opinion: Why aren't we investing in Ireland's remote working infrastructure?,opinion arent investing irelands remote working infrastructure,0,0,0,0,0,0,1,0,0,2023.0,1.0,0.0,1.0,0.0,0.0,neu
ireland,I don't want more chargers I want decent rail infrastructure,dont want chargers want decent rail infrastructure,0,0,0,0,0,0,1,0,0,2023.0,1.0,0.328,0.672,0.0,-0.1139,neg
ireland,Day in the life of someone with no car living in Dublin,day life someone car living dublin,0,0,0,0,0,0,0,0,0,2023.0,,0.0,1.0,0.0,0.0,neu
ireland,All this money we have,money,0,0,0,0,0,0,0,0,0,2023.0,,0.0,1.0,0.0,0.0,neu
ireland,"Streetlights in NI could be turned off in cost-cutting measure, warns department of Infrastructure",streetlights ni could turned costcutting measure warns department infrastructure,0,0,0,0,0,0,1,0,0,2023.0,1.0,0.149,0.851,0.0,-0.1027,neg
ireland,"Any sensible driver should be in full support of bicycle infrastructure. The more people that ride, the more people that don't drive. And that means less traffic. And no-one likes traffic.",sensible driver full support bicycle infrastructure people ride people dont drive means less traffic noone likes traffic,0,0,0,0,0,0,1,0,0,2023.0,1.0,0.0,0.741,0.259,0.6412,pos
ireland,Better solutions for the housing crisis,better solutions housing crisis,0,1,0,0,0,0,0,0,0,2023.0,1.0,0.423,0.103,0.474,-0.128,neg
ireland,"These people going on about turf cutting as a tradition, seem to gloss over this. ",people going turf cutting tradition seem gloss,0,0,0,0,0,0,0,0,0,2023.0,,0.2,0.8,0.0,-0.128,neg
ireland,Saying the quiet parts out loud? 🤔,saying quiet parts loud,0,0,0,0,0,0,0,0,0,2023.0,,0.0,1.0,0.0,0.0,neu
ireland,Stuck on the dole,stuck dole,0,0,0,0,0,0,0,0,0,2023.0,,0.667,0.333,0.0,-0.25,neg
ireland,There are some scummy employers in this country....,scummy employers country,0,0,0,0,0,0,0,0,0,2023.0,,0.0,1.0,0.0,0.0,neu
ireland,"Next time your employer asks you to come back to the office, show them this picture",next time employer asks come back office show picture,0,0,0,0,0,0,0,0,0,2023.0,,0.0,1.0,0.0,0.0,neu
ireland,Fishers voice fears as off-shore wind projects advance,fishers voice fears offshore wind projects advance,0,0,0,0,0,0,0,0,0,2023.0,,0.318,0.682,0.0,-0.4215,neg
ireland,The unemployment rate across the US and the EU in January 2023. The US average unemployment rate is 3.5%. The EU average unemployment rate is 6.1%,unemployment rate across us eu january 2023 us average unemployment rate 3 5 eu average unemployment rate 6 1,0,0,0,0,0,0,0,0,0,2023.0,,0.42,0.58,0.0,-0.8271,neg
ireland,Irish supermarket doesn't want to pay a living wage to locals so instead are recruiting 100 people from abroad. Yet another case of “nobody wants to work” but this multimillion euro company prefers to outsource labor over paying a living wage to their own people.,irish supermarket doesnt want pay living wage locals instead recruiting 100 people abroad yet another case nobody wants work multimillion euro company prefers outsource labor paying living wage people,0,0,0,0,0,0,0,1,0,2022.0,1.0,0.041,0.915,0.044,0.0191,neu
ireland,Irish women who lived as men in the US Civil War.,irish women lived men us civil war,0,0,0,0,0,0,0,0,0,2023.0,,0.394,0.606,0.0,-0.5994,neg
ireland,Starting Mushroom Buissnes in Ireland?,starting mushroom buissnes ireland,0,0,0,0,0,0,0,0,0,2022.0,,0.0,1.0,0.0,0.0,neu
ireland,How to get a *decent* job?,get decent job,0,0,0,0,0,0,0,0,0,2023.0,,0.0,1.0,0.0,0.0,neu
ireland,"You might think £4975 is a bit steep - but a corner house was £500 more expensive, as you could always build a nice big extension in the side garden.",might think 4975 bit steep corner house 500 expensive could always build nice big extension side garden,0,0,0,0,0,0,0,0,0,2023.0,,0.0,0.851,0.149,0.4215,pos
ireland,"The current Irish National Minimum Wage is €11.30. In 2019, it was €9.80. New figures out today show inflation (CPI) from Jan 2019 to April 2023 has been 18.1% The minimum wage is now worth 2.8% less in real terms than it was 4 years ago",current irish national minimum wage 11 30 2019 9 80 new figures today show inflation cpi jan 2019 april 2023 18 1 minimum wage worth 2 8 less real terms 4 years ago,0,0,0,0,0,0,0,0,0,2023.0,,0.0,0.934,0.066,0.2263,pos
ireland,Irish employers that force people with WFH type jobs into the office are absolute wankers. Change my opinion.,irish employers force people wfh type jobs office absolute wankers change opinion,0,0,0,0,0,0,0,0,0,2023.0,,0.0,1.0,0.0,0.0,neu
ireland,How much to pay a junkie?,much pay junkie,0,0,0,0,0,0,0,0,0,2023.0,,0.412,0.588,0.0,-0.1027,neg
ireland,Hospitality bosses and the struggle to get staff.,hospitality bosses struggle get staff,0,0,0,0,0,0,0,0,0,2023.0,,0.365,0.635,0.0,-0.3182,neg
ireland,Irish workers’ wages lag behind inflation as executive pay booms - Oxfam,irish workers wages lag behind inflation executive pay booms oxfam,0,0,0,0,0,0,0,0,1,2023.0,1.0,0.322,0.678,0.0,-0.4215,neg
ireland,Things aren't worth the money anymore,things arent worth money anymore,0,0,0,0,0,0,0,0,0,2023.0,,0.294,0.706,0.0,-0.1695,neg
ireland,"You wake up tomorrow at 31 and you’re unemployed with no degree. After doing a year of therapy and self work, you decide you want to pursue an education/career that will earn you a decent wage. What are you doing?",wake tomorrow 31 unemployed degree year therapy self work decide want pursue education career earn decent wage,0,0,0,0,0,0,0,0,0,2023.0,,0.0,0.925,0.075,0.0772,pos
ireland,"IWU serves strike notice on Iceland retail stores for Dublin stores, more details on IWU social media.",iwu serves strike notice iceland retail stores dublin stores details iwu social media,0,0,0,0,0,0,0,0,0,2023.0,,0.111,0.889,0.0,-0.128,neg
europe,Europe’s housing market has turned,europe housing market turned,1,1,0,0,0,0,0,0,0,2023.0,1.0,0.0,1.0,0.0,0.0,neu
europe,Central Europe has the least affordable housing market.,central europe least affordable housing market,1,1,0,0,0,0,0,0,0,2022.0,1.0,0.0,1.0,0.0,0.0,neu
europe,housing market in the EU,housing market eu,1,1,0,0,0,0,0,0,0,2023.0,1.0,0.0,1.0,0.0,0.0,neu
europe,Sweden's black housing market: a billion sek industry,swedens black housing market billion sek industry,1,1,0,0,0,0,0,0,0,2018.0,1.0,0.0,1.0,0.0,0.0,neu
europe,"Germany’s housing market is facing a serious downturn in prices, analysts say",germany housing market facing serious downturn prices analysts say,1,1,0,0,0,0,0,0,0,2022.0,1.0,0.14,0.86,0.0,-0.0772,neg
europe,Sweden faces recession as housing market troubles take toll on economy,sweden faces recession housing market troubles take toll economy,1,1,0,0,0,0,0,0,0,2023.0,1.0,0.453,0.547,0.0,-0.7003,neg
europe,"Redditors who live in East European countries whose population shrank in the last decade, how's the house market like?",redditors live east european countries whose population shrank last decade hows house market like,0,0,0,0,0,0,0,0,0,2015.0,,0.0,0.839,0.161,0.3612,pos
europe,Airbnb Hikes Paris Rental Housing Market Prices,airbnb hikes paris rental housing market prices,1,1,0,0,0,0,0,0,0,2016.0,1.0,0.0,1.0,0.0,0.0,neu
europe,Housing market bubble ranking,housing market bubble ranking,1,1,0,0,0,0,0,0,0,2021.0,1.0,0.0,1.0,0.0,0.0,neu
europe,Norwegian Parliamentary Election 2021,norwegian parliamentary election 2021,0,0,0,0,0,0,0,0,0,2021.0,,0.0,1.0,0.0,0.0,neu
europe,Europe’s housing market has turned,europe housing market turned,1,1,0,0,0,0,0,0,0,2023.0,1.0,0.0,1.0,0.0,0.0,neu
europe,"Soviet housing in Tartu, Estonia.",soviet housing tartu estonia,0,1,0,0,0,0,0,0,0,2022.0,1.0,0.0,1.0,0.0,0.0,neu
europe,"Sweden’s PM: ‘We don’t want Chinatown, Somalitown, or Little Italy’. Sweden's Prime Minister has restated her determination to reduce housing segregation in the country's cities, while underlining that this does not have to mean ""forcibly moving people"".",sweden pm want chinatown somalitown little italy swedens prime minister restated determination reduce housing segregation countrys cities underlining mean forcibly moving people,0,1,0,0,0,0,0,0,0,2022.0,1.0,0.0,0.833,0.167,0.4588,pos
europe,What living in social housing in Vienna is. (Everyone can get a flat in this System. You don‘t have to be low income),living social housing vienna everyone get flat system low income,0,1,0,0,0,0,0,0,0,2022.0,1.0,0.189,0.811,0.0,-0.2732,neg
europe,Tens of thousands march in protest over Portugal’s ‘impossible’ housing crisis,tens thousands march protest portugal impossible housing crisis,0,1,0,0,0,0,0,0,0,2023.0,1.0,0.504,0.496,0.0,-0.7269,neg
europe,"50 years ago today, the Bloody Sunday massacre occurred in the Bogside area of Derry, Northern Ireland, where British soldiers shot 26 unarmed civilians and killed 14, some of them as young as 17 years old, who were peacefully protesting discrimination against Catholics in housing and employment.",50 years ago today bloody sunday massacre occurred bogside area derry northern ireland british soldiers shot 26 unarmed civilians killed 14 young 17 years old peacefully protesting discrimination catholics housing employment,0,1,0,0,0,0,0,0,0,2022.0,1.0,0.251,0.665,0.084,-0.7783,neg
europe,'People are really fired up': Digital nomads blamed for Portugal's high prices and housing crisis,people really fired digital nomads blamed portugals high prices housing crisis,0,1,0,0,0,0,0,0,0,2023.0,1.0,0.581,0.419,0.0,-0.902,neg
europe,Development of the heating structure in new residential construction in Germany. Only 10% of new housing permits approved so far this year are for houses heated by natural gas,development heating structure new residential construction germany 10 new housing permits approved far year houses heated natural gas,0,1,0,0,1,0,0,0,0,2023.0,1.0,0.0,0.751,0.249,0.6486,pos
europe,"Meanwhile in Switzerland ... we are blessed with affordable, accessible, and quality housing [OC]",meanwhile switzerland blessed affordable accessible quality housing oc,0,1,0,0,0,0,0,0,0,2015.0,1.0,0.0,0.642,0.358,0.5994,pos
europe,"“Housing is a right, not a commodity”: Polish opposition leader proposes interest-free mortgages",housing right commodity polish opposition leader proposes interestfree mortgages,0,1,0,0,0,0,0,0,0,2023.0,1.0,0.0,1.0,0.0,0.0,neu
europe,Finland moves to restrict property purchases by non-EU citizens,finland moves restrict property purchases noneu citizens,0,0,1,0,0,0,0,0,0,2022.0,1.0,0.302,0.698,0.0,-0.3818,neg
europe,Dutch cities want to ban property investors in all neighborhoods,dutch cities want ban property investors neighborhoods,0,0,1,0,0,0,0,0,0,2021.0,1.0,0.364,0.505,0.131,-0.5106,neg
europe,Since I see no one talking about this: There are massive anti-government protests in Montenegro against a government that seeks to confiscate Serbian orthodox church property. People have been arrested.,since see one talking massive antigovernment protests montenegro government seeks confiscate serbian orthodox church property people arrested,0,0,1,0,0,0,0,0,0,2019.0,1.0,0.25,0.75,0.0,-0.6124,neg
europe,U.S. senators want Poland to pay victims of Nazi property thefts,u senators want poland pay victims nazi property thefts,0,0,1,0,0,0,0,0,0,2019.0,1.0,0.37,0.5,0.13,-0.34,neg
europe,"Greeks Rush to Turkey for Shopping, Property as Lira Collapses",greeks rush turkey shopping property lira collapses,0,0,1,0,0,0,0,0,0,2021.0,1.0,0.268,0.732,0.0,-0.296,neg
europe,"€511.3mn of funds for roads in Bulgaria spent on luxury properties, interior minister says",511 3mn funds roads bulgaria spent luxury properties interior minister says,0,0,0,0,0,0,0,0,0,2022.0,,0.0,1.0,0.0,0.0,neu
europe,Berlin buys 670 flats on Karl-Marx-Allee from private owner - Move to renationalise buildings follows protests over rising property prices in the city,berlin buys 670 flats karlmarxallee private owner move renationalise buildings follows protests rising property prices city,0,0,1,0,0,1,0,0,0,2019.0,1.0,0.112,0.888,0.0,-0.2263,neg
