Subreddit,Original Title,Title,housing market,housing,property,real estate,construction,building,infrastructure,labor,wages,Created,Match,neg,neu,pos,compound,label
germany,Do municipalities provide free hotel stays to locals due to noise disturbances when there is construction work near houses on weekends?,municipalities provide free hotel stays locals due noise disturbances construction work near houses weekends,0,0,0,0,1,0,0,0,0,2023.0,1.0,0.136,0.678,0.186,0.2263,pos
germany,is there a notice period for construction in rented property?,notice period construction rented property,0,0,1,0,1,0,0,0,0,2023.0,1.0,0.0,1.0,0.0,0.0,neu
germany,Rights to water at work - Construction Sites,rights water work construction sites,0,0,0,0,1,0,0,0,0,2022.0,1.0,0.0,1.0,0.0,0.0,neu
germany,German soldiers march in front of the Reichstag building to honor those who served in Afghanistan. 20 years Bundeswehr in the Hindu Kush. 20 years that have shaped Germany.,german soldiers march front reichstag building honor served afghanistan 20 years bundeswehr hindu kush 20 years shaped germany,0,0,0,0,0,1,0,0,0,2021.0,1.0,0.0,0.842,0.158,0.4939,pos
germany,Why does Germany have a culture of building your own kitchen?,germany culture building kitchen,0,0,0,0,0,1,0,0,0,2022.0,1.0,0.0,1.0,0.0,0.0,neu
germany,"Near Zoologischer Garten, Berlin. (Don't know the name of this beautiful building)",near zoologischer garten berlin dont know name beautiful building,0,0,0,0,0,1,0,0,0,2022.0,1.0,0.282,0.718,0.0,-0.4847,neg
germany,I was woken up at night by this high pitched noise inside/outside my apartment building. Was ist das?,woken night high pitched noise inside outside apartment building ist das,0,0,0,0,0,1,0,0,0,2022.0,1.0,0.0,1.0,0.0,0.0,neu
germany,"This is absolutely amazing to me - new builds in Düsseldorf, Germany.",absolutely amazing new builds düsseldorf germany,0,0,0,0,0,0,0,0,0,2022.0,,0.0,0.55,0.45,0.624,pos
germany,Cool building in Berlin by German artists Michael Fischer!,cool building berlin german artists michael fischer,0,0,0,0,0,1,0,0,0,2020.0,1.0,0.0,0.723,0.277,0.3182,pos
germany,We build Reichstag in Minecraft,build reichstag minecraft,0,0,0,0,0,0,0,0,0,2022.0,,0.0,1.0,0.0,0.0,neu
germany,I recently moved in to a new flat… Where do I file a serious complaint? landlord has been contacted and nothing is done about it. WTF kinda people think it is okay to throw their garbage in the backyard. I’m disgusted by them entering the building and embarrassed too to call this my home.,recently moved new flat file serious complaint landlord contacted nothing done wtf kinda people think okay throw garbage backyard disgusted entering building embarrassed call home,0,0,0,0,0,1,0,0,0,2022.0,1.0,0.284,0.574,0.142,-0.5707,neg
germany,The amazing city hall of Hanover. I never get bored looking at this building.,amazing city hall hanover never get bored looking building,0,0,0,0,0,1,0,0,0,2020.0,1.0,0.0,0.555,0.445,0.6822,pos
germany,I found this building in Braunschweig,found building braunschweig,0,0,0,0,0,1,0,0,0,2020.0,1.0,0.0,1.0,0.0,0.0,neu
germany,What’s happening to electric car charging infrastructure?,happening electric car charging infrastructure,0,0,0,0,0,0,1,0,0,2023.0,1.0,0.0,1.0,0.0,0.0,neu
germany,Visiting Cologne for CSD. You guys have a great street infrastructure here. Not surprised when I saw the density on the map.,visiting cologne csd guys great street infrastructure surprised saw density map,0,0,0,0,0,0,1,0,0,2019.0,1.0,0.0,0.6,0.4,0.7184,pos
germany,Cries in German internet infrastructure and prices.,cries german internet infrastructure prices,0,0,0,0,0,0,1,0,0,2021.0,1.0,0.403,0.597,0.0,-0.4019,neg
germany,Would love to know about the back story!,would love know back story,0,0,0,0,0,0,0,0,0,2021.0,,0.0,0.488,0.512,0.6369,pos
germany,What's the warmest city which also has good bike infrastructure?,whats warmest city also good bike infrastructure,0,0,0,0,0,0,1,0,0,2023.0,1.0,0.0,0.472,0.528,0.6808,pos
germany,EV infrastructure in Germany and future plans,ev infrastructure germany future plans,0,0,0,0,0,0,1,0,0,2023.0,1.0,0.0,1.0,0.0,0.0,neu
germany,is being really tired a legit reason to take a sick day off?,really tired legit reason take sick day,0,0,0,0,0,0,0,0,0,2023.0,,0.565,0.435,0.0,-0.7574,neg
germany,"I haven't experienced a single power cut since moving to Germany. In England, it was a monthly occurrence. Well done, German infrastructure.",havent experienced single power cut since moving germany england monthly occurrence well done german infrastructure,0,0,0,0,0,0,1,0,0,2021.0,1.0,0.122,0.756,0.122,0.0,neu
germany,where should I go in germany if I am interested in beautiful architecture and a well build infrastructure,go germany interested beautiful architecture well build infrastructure,0,0,0,0,0,0,1,0,0,2022.0,1.0,0.0,0.365,0.635,0.8271,pos
germany,"Why German Trains Don’t Run On Time: You can no longer set your watch by German trains. Massive infrastructure repairs have set off an epidemic of unpunctuality, which could ultimately cost Deutsche Bahn CEO Rüdiger Grube his job",german trains run time longer set watch german trains massive infrastructure repairs set epidemic unpunctuality could ultimately cost deutsche bahn ceo rüdiger grube job,0,0,0,0,0,0,1,0,0,2016.0,1.0,0.0,1.0,0.0,0.0,neu
germany,Is Germany's skilled-labor shortage a myth?,germanys skilledlabor shortage myth,0,0,0,0,0,0,0,1,0,2023.0,1.0,0.4,0.6,0.0,-0.25,neg
germany,Federal Labor Minister Hubert Heil expects the minimum wage to rise sharply next year. The reason for this is high inflation and wage increases.,federal labor minister hubert heil expects minimum wage rise sharply next year reason high inflation wage increases,0,0,0,0,0,0,0,1,0,2023.0,1.0,0.0,1.0,0.0,0.0,neu
germany,Why do Germans entertain homeopathy as a real medicine when studies have shown that it is useless?,germans entertain homeopathy real medicine studies shown useless,0,0,0,0,0,0,0,0,0,2022.0,,0.252,0.541,0.207,-0.128,neg
germany,Are manual labor jobs underpaid in germany?,manual labor jobs underpaid germany,0,0,0,0,0,0,0,1,0,2023.0,1.0,0.0,1.0,0.0,0.0,neu
germany,Labor questions: on a Blue Card at 22 months in with a better job offer. Could someone help me clarifying some doubts?,labor questions blue card 22 months better job offer could someone help clarifying doubts,0,0,0,0,0,0,0,1,0,2023.0,1.0,0.117,0.585,0.298,0.5267,pos
germany,"Government draft law for immigration reform: I have read it so you don't have to, here are all the relevant changes",government draft law immigration reform read dont relevant changes,0,0,0,0,0,0,0,0,0,2023.0,,0.0,1.0,0.0,0.0,neu
germany,"Hi! question about work, labor law in Germany. Pls help",hi question work labor law germany pls help,0,0,0,0,0,0,0,1,0,2022.0,1.0,0.0,0.6,0.4,0.4588,pos
germany,Does anyone have experience in filing a complaint in Munich Labor Court?,anyone experience filing complaint munich labor court,0,0,0,0,0,0,0,1,0,2022.0,1.0,0.268,0.732,0.0,-0.296,neg
germany,"I had a THIRD generation Turkish-German taxi driver who used ""they"" when he talked about Germans. Is this common?",third generation turkishgerman taxi driver used talked germans common,0,0,0,0,0,0,0,0,0,2023.0,,0.0,1.0,0.0,0.0,neu
germany,"Newbie Question: Why does it seem that doing a Phd in Germany and the rest of Europe is much more straightforward, while doing a Phd in America is more of a ""Career commitment"" and possibly a ""Limbo""? (Concrete Evidence and Labor Laws)",newbie question seem phd germany rest europe much straightforward phd america career commitment possibly limbo concrete evidence labor laws,0,0,0,0,0,0,0,1,0,2022.0,1.0,0.0,0.874,0.126,0.3818,pos
germany,The factory that I work in is so desperate for workers they are hiring 60 and 70 year olds. I have one colleague that is in his 80s! They would do anything but raise the wages from 1400. I love capitalism,factory work desperate workers hiring 60 70 year olds one colleague 80s would anything raise wages 1400 love capitalism,0,0,0,0,0,0,0,0,1,2022.0,1.0,0.098,0.723,0.179,0.4404,pos
germany,Why are wages not increasing with inflation in germany?,wages increasing inflation germany,0,0,0,0,0,0,0,0,1,2022.0,1.0,0.0,1.0,0.0,0.0,neu
germany,IT jobs wages in Germany,jobs wages germany,0,0,0,0,0,0,0,0,1,2022.0,1.0,0.0,1.0,0.0,0.0,neu
germany,"[PSA] From tomorrow, the new German minimum wage is 10.45€.",psa tomorrow new german minimum wage 10 45,0,0,0,0,0,0,0,0,0,2022.0,,0.0,1.0,0.0,0.0,neu
germany,How do German apprentices survive on an apprentices wage?,german apprentices survive apprentices wage,0,0,0,0,0,0,0,0,0,2022.0,,0.0,1.0,0.0,0.0,neu
germany,The Uber Files: Scholz was laughed “a real comedian” by Uber when he rejected to cooperate unless Uber pays a minimum wage,uber files scholz laughed real comedian uber rejected cooperate unless uber pays minimum wage,0,0,0,0,0,0,0,0,0,2022.0,,0.176,0.538,0.287,0.3117,pos
germany,What is the living standard if you earn the minimum wage in Germany?,living standard earn minimum wage germany,0,0,0,0,0,0,0,0,0,2022.0,,0.0,1.0,0.0,0.0,neu
germany,Data on wages and crime rates for Indians in Germany,data wages crime rates indians germany,0,0,0,0,0,0,0,0,1,2023.0,1.0,0.412,0.588,0.0,-0.5423,neg
germany,Federal Labor Minister Hubert Heil expects the minimum wage to rise sharply next year. The reason for this is high inflation and wage increases.,federal labor minister hubert heil expects minimum wage rise sharply next year reason high inflation wage increases,0,0,0,0,0,0,0,1,0,2023.0,1.0,0.0,1.0,0.0,0.0,neu
germany,the rise of minimum wage should start already in the end of October?,rise minimum wage start already end october,0,0,0,0,0,0,0,0,0,2022.0,,0.0,1.0,0.0,0.0,neu
france,How'd you compare living in the UK and France? Feel free to share any and every info or facts etc.,howd compare living uk france feel free share every info facts etc,0,0,0,0,0,0,0,0,0,2022.0,,0.0,0.645,0.355,0.6705,pos
france,Chez Nestor (warning for foreign students),chez nestor warning foreign students,0,0,0,0,0,0,0,0,0,2022.0,,0.375,0.625,0.0,-0.34,neg
france,Mon expérience au Danemark,experience denmark,0,0,0,0,0,0,0,0,0,2022.0,,0.0,1.0,0.0,0.0,neu
france,"Moving to France dream to reality - can you answer questions for my research? Building/Renovation, things to know/do/not do?",moving france dream reality answer questions research building renovation things know,0,0,0,0,0,1,0,0,0,2022.0,1.0,0.0,0.833,0.167,0.25,pos
france,Une question sur les logements vacants,question vacancies,0,1,0,0,0,0,0,0,0,2021.0,1.0,0.0,1.0,0.0,0.0,neu
france,American Author looking for French citizen perspectives,american author looking french citizen perspectives,0,0,0,0,0,0,0,0,0,2016.0,,0.0,1.0,0.0,0.0,neu
france,Grad School Advice,grad school advice,0,0,0,0,0,0,0,0,0,2020.0,,0.0,1.0,0.0,0.0,neu
france,Need help to find a french real estate agency,need help find french real estate agency,0,0,0,1,0,0,0,0,0,2016.0,1.0,0.0,0.69,0.31,0.4019,pos
france,The Consul (part i),consul part,0,0,0,0,0,0,0,0,0,2018.0,,0.0,1.0,0.0,0.0,neu
france,Besoin D'aide et d'idées neuves pour vendre la maison de ma mère dans les Landes,need help new ideas sell mothers house landes,0,0,0,0,0,0,0,0,0,2013.0,,0.0,0.722,0.278,0.4019,pos
france,Acheter un terrain à plusieurs ?,buying land together,0,0,0,0,0,0,0,0,0,2023.0,,0.0,1.0,0.0,0.0,neu
france,Une histoire une peu mignonne.,bit cute story,0,0,0,0,0,0,0,0,0,2023.0,,0.0,0.4,0.6,0.4588,pos
france,A la recherche d’un casque audio,looking headphones,0,0,0,0,0,0,0,0,0,2023.0,,0.0,1.0,0.0,0.0,neu
france,Purchasing neighbours land in rural France. How can we show interest?,purchasing neighbours land rural france show interest,0,0,0,0,0,0,0,0,0,2023.0,,0.0,0.667,0.333,0.4588,pos
france,"An expat, yes another one, with basic (very basic) questions. Thanks in advance to all the helpers!!",expat yes another one basic basic questions thanks advance helpers,0,0,0,0,0,0,0,0,0,2023.0,,0.0,0.476,0.524,0.7717,pos
france,Le Seigneur des anneaux : Amazon annule sa série et intègre le multivers lancé par Warner,lord rings amazon cancels series integrates multiverse launched warner,0,0,0,0,0,0,0,0,0,2023.0,,0.171,0.541,0.288,0.0772,pos
france,ChatGPT Is a Blurry JPEG of the Web (traduction fr dans le poteau),chatgpt blurry jpeg web traduction fr dans le poteau,0,0,0,0,0,0,0,0,0,2023.0,,0.149,0.851,0.0,-0.1027,neg
france,Being asked by landlord to move out because of newborn baby?,asked landlord move newborn baby,0,0,0,0,0,0,0,0,0,2023.0,,0.0,1.0,0.0,0.0,neu
france,Création d'entreprise,business creation,0,0,0,0,0,0,0,0,0,2023.0,,0.0,0.323,0.677,0.2732,pos
france,Divorce related help?,divorce related help,0,0,0,0,0,0,0,0,0,2023.0,,0.0,0.426,0.574,0.4019,pos
france,Purchasing neighbours land in rural France. How can we show interest?,purchasing neighbours land rural france show interest,0,0,0,0,0,0,0,0,0,2023.0,,0.0,0.667,0.333,0.4588,pos
france,"Il est maintenant légal au Missouri, US, pour les enfants non-supervisés de porter une arme à feu ouvertement dans les endroits publics.",legal missouri us unsupervised children openly carry firearm public places,0,0,0,0,0,0,0,0,0,2023.0,,0.0,0.857,0.143,0.128,pos
france,Question for the business people from France,question business people france,0,0,0,0,0,0,0,0,0,2023.0,,0.0,1.0,0.0,0.0,neu
france,Can I sleep in my car in a carpark by the telecabine in Les Carroz?,sleep car carpark telecabine les carroz,0,0,0,0,0,0,0,0,0,2023.0,,0.0,1.0,0.0,0.0,neu
france,House we own in France.,house france,0,0,0,0,0,0,0,0,0,2023.0,,0.0,1.0,0.0,0.0,neu
france,"[Update] to post [Lost property in Châtellerault, France]. I came here to get help to find a blanket that I left behind when travelling in France and thanks to all of you who upvoted the post, shared, and commented, it arrived on the mail! Eternally grateful folks, thanks again!",update post lost property châtellerault france came get help find blanket left behind travelling france thanks upvoted post shared commented arrived mail eternally grateful folks thanks,0,0,1,0,0,0,0,0,0,2022.0,1.0,0.064,0.552,0.384,0.891,pos
france,My previous landlord is trying to falsely make money from me.,previous landlord trying falsely make money,0,0,0,0,0,0,0,0,0,2022.0,,0.0,1.0,0.0,0.0,neu
france,"Lost property in Châtellerault, France",lost property châtellerault france,0,0,1,0,0,0,0,0,0,2022.0,1.0,0.434,0.566,0.0,-0.3182,neg
france,French Council Tax,french council tax,0,0,0,0,0,0,0,0,0,2022.0,,0.0,1.0,0.0,0.0,neu
france,Advice on the role of a notaire in purchasing a house in France.,advice role notaire purchasing house france,0,0,0,0,0,0,0,0,0,2022.0,,0.0,1.0,0.0,0.0,neu
france,Une histoire une peu mignonne.,bit cute story,0,0,0,0,0,0,0,0,0,2023.0,,0.0,0.4,0.6,0.4588,pos
france,Square meter price in large cities with more than 100k residents,square meter price large cities 100k residents,0,0,0,0,0,0,0,0,0,2023.0,,0.0,1.0,0.0,0.0,neu
france,"The Inquiring Photographer, il y a 100 ans, demandait à des gens ce qu'ils pensaient de militants rebelles en France qui ne voulaient plus lever leur chapeau aux femmes l'hiver",inquiring photographer 100 years ago asked people thought rebel militants france longer wanted tip hats women winter,0,0,0,0,0,0,0,0,0,2022.0,,0.091,0.909,0.0,-0.1531,neg
france,Buying agrcultural Land to turn into forest as EU citizen,buying agrcultural land turn forest eu citizen,0,0,0,0,0,0,0,0,0,2022.0,,0.0,1.0,0.0,0.0,neu
france,Guide d'achat moniteurs,monitor buying guide,0,0,0,0,0,0,0,0,0,2021.0,,0.0,1.0,0.0,0.0,neu
france,Le « Real Estate Porn » est un marché plus chaud que jamais,real estate porn hotter market ever,0,0,0,1,0,0,0,0,0,2022.0,1.0,0.0,1.0,0.0,0.0,neu
france,"Des choses exotiques ont eu lieu sur le système électrique français ce week-end, et méritent qu'on en dise un mot !",exotic things took place french electricity system weekend deserve word,0,0,0,0,0,0,0,0,0,2019.0,,0.0,1.0,0.0,0.0,neu
france,My husband died. Stay at home mum with toddler. Not sure what to do next?,husband died stay home mum toddler sure next,0,0,0,0,0,0,0,0,0,2020.0,,0.303,0.504,0.193,-0.3182,neg
france,House prices in Grasse area,house prices grasse area,0,0,0,0,0,0,0,0,0,2021.0,,0.0,1.0,0.0,0.0,neu
france,Cette carte montre là où l'Homme... n'est pas.,map shows man,0,0,0,0,0,0,0,0,0,2020.0,,0.0,1.0,0.0,0.0,neu
france,Faire ou ne pas faire barrage en 2027 ?,block block 2027,0,0,0,0,0,0,0,0,0,2023.0,,0.853,0.147,0.0,-0.7003,neg
france,"Loi ""anti-casseurs"" : le gouvernement réfléchit à un ""délit de construction de barricades""",antithugs law government considering offence building barricades,0,0,0,0,1,0,0,0,0,2023.0,1.0,0.268,0.732,0.0,-0.296,neg
france,"Macron, le fascisme et l’autoritarisme du futur",macron fascism authoritarianism future,0,0,0,0,0,0,0,0,0,2023.0,,0.0,1.0,0.0,0.0,neu
france,RSA et scène musicale,rsa music scene,0,0,0,0,0,0,0,0,0,2023.0,,0.0,1.0,0.0,0.0,neu
france,Vosges : une commune décide d’interdire les constructions pour préserver sa biodiversité,vosges municipality decides ban construction preserve biodiversity,0,0,0,0,1,0,0,0,0,2023.0,1.0,0.375,0.625,0.0,-0.5574,neg
france,"C'est une chose d'être pauvre, c'est autre chose d'être radin",one thing poor another thing stingy,0,0,0,0,0,0,0,0,0,2023.0,,0.588,0.412,0.0,-0.6908,neg
france,"Remplacement des chaudières à gaz : pour les artisans, «le calendrier n'est pas tenable»",replacement gas boilers craftsmen schedule sustainable,0,0,0,0,0,0,0,0,0,2023.0,,0.0,1.0,0.0,0.0,neu
france,Sainte-Soline : un avant goût des blocages face aux EPR2 ?,saintesoline taste blockages facing epr2,0,0,0,0,0,0,0,0,0,2023.0,,0.0,1.0,0.0,0.0,neu
france,"Quel avenir pour la passerelle Eiffel à Bordeaux, une des premières constructions de Gustave Eiffel ?",future eiffel footbridge bordeaux one gustave eiffels first constructions,0,0,0,0,1,0,0,0,0,2023.0,1.0,0.0,1.0,0.0,0.0,neu
france,AMA : Je suis Architecte,ama architect,0,0,0,0,0,0,0,0,0,2023.0,,0.0,1.0,0.0,0.0,neu
france,"Bilan 2022 - Mec tout seul avec deux chats dans une ville d'environ 70 000 habitants, moyennes mensuelles",2022 review alone guy two cats city around 70 000 people monthly averages,0,0,0,0,0,0,0,0,0,2023.0,,0.143,0.857,0.0,-0.25,neg
france,French Parliament unanimously vote to officially launch the studies to build a 2nd Sister-Ship NewGen Nuclear Aircraft Carrier (EMALS/AAG) 83.000 Tons PANG.,french parliament unanimously vote officially launch studies build 2nd sistership newgen nuclear aircraft carrier emals aag 83 000 tons pang,0,0,0,0,0,0,0,0,0,2023.0,,0.0,1.0,0.0,0.0,neu
france,Questions From your ignorant brother on the other side of the pond,questions ignorant brother side pond,0,0,0,0,0,0,0,0,0,2023.0,,0.344,0.656,0.0,-0.2732,neg
france,Les CRS allemands battus et humiliés par un sorcier de la boue,german crs beaten humiliated mud wizard,0,0,0,0,0,0,0,0,0,2023.0,,0.565,0.435,0.0,-0.6369,neg
france,Being asked by landlord to move out because of newborn baby?,asked landlord move newborn baby,0,0,0,0,0,0,0,0,0,2023.0,,0.0,1.0,0.0,0.0,neu
france,Help,help,0,0,0,0,0,0,0,0,0,2023.0,,0.0,0.0,1.0,0.4019,pos
france,Rostov explosion: Russian secret service FSB building erupts in flames after loud bangs,rostov explosion russian secret service fsb building erupts flames loud bangs,0,0,0,0,0,1,0,0,0,2023.0,1.0,0.0,1.0,0.0,0.0,neu
france,Help me locate this building in France?,help locate building france,0,0,0,0,0,1,0,0,0,2023.0,1.0,0.0,0.526,0.474,0.4019,pos
france,La Poste doest ring the bell and claims they tried to deliver,la poste doest ring bell claims tried deliver,0,0,0,0,0,0,0,0,0,2023.0,,0.0,1.0,0.0,0.0,neu
france,Most Disturbing Experience in Paris.,disturbing experience paris,0,0,0,0,0,0,0,0,0,2023.0,,0.623,0.377,0.0,-0.5106,neg
france,Il faudrait faire quoi concrètement pour que le RER ça soit moins pété ?,done concretely rer less farted,0,0,0,0,0,0,0,0,0,2023.0,,0.0,1.0,0.0,0.0,neu
france,Quelles sont les bonnes nouvelles en France ?,good news france,0,0,0,0,0,0,0,0,0,2023.0,,0.0,0.408,0.592,0.4404,pos
france,Moscou face à l’échec de sa campagne de bombardements des infrastructures énergétiques ukrainiennes,moscow faced failure campaign bomb ukraines energy infrastructure,0,0,0,0,0,0,1,0,0,2023.0,1.0,0.478,0.368,0.154,-0.6597,neg
france,[Sur le front] Pourquoi le train est-il toujours plus cher ?,front train always expensive,0,0,0,0,0,0,0,0,0,2023.0,,0.0,1.0,0.0,0.0,neu
france,La France se penche sur l'avenir de ses infrastructures gazières,france considering future gas infrastructure,0,0,0,0,0,0,1,0,0,2023.0,1.0,0.0,1.0,0.0,0.0,neu
france,"Mon directeur de pôle ne délègue pas, que faire ?",division director delegate,0,0,0,0,0,0,0,0,0,2023.0,,0.0,1.0,0.0,0.0,neu
france,"Pensez-vous que les JO 2024 vont réellement permettre de ""dynamiser"" la Seine Saint Denis?",think 2024 olympics really make possible revitalize seine saint denis,0,0,0,0,0,0,0,0,0,2023.0,,0.0,1.0,0.0,0.0,neu
france,"Fabien Bouglé : ""L'Allemagne mène une offensive terrible pour détruire EDF""",fabien bouglé germany leading terrible offensive destroy edf,0,0,0,0,0,0,0,0,0,2023.0,,0.658,0.342,0.0,-0.8625,neg
france,"Troll gentil : les pro nucléaire, vous savez lire ? Source GIEC",nice troll nuclear pros read source ipcc,0,0,0,0,0,0,0,0,0,2023.0,,0.0,0.682,0.318,0.4215,pos
france,Global Innovation Index 2022 (the most innovative countries in the world),global innovation index 2022 innovative countries world,0,0,0,0,0,0,0,0,0,2023.0,,0.0,0.476,0.524,0.6705,pos
france,50 French Rappers will organize a solidarity concert to raise money for labor unions and workers on strike,50 french rappers organize solidarity concert raise money labor unions workers strike,0,0,0,0,0,0,0,1,0,2023.0,1.0,0.109,0.73,0.161,0.1779,pos
france,Questions From your ignorant brother on the other side of the pond,questions ignorant brother side pond,0,0,0,0,0,0,0,0,0,2023.0,,0.344,0.656,0.0,-0.2732,neg
france,Nucléaire : la France essuie un nouveau revers à Bruxelles,nuclear france suffers new setback brussels,0,0,0,0,0,0,0,0,0,2023.0,,0.383,0.617,0.0,-0.4767,neg
france,"Annonce de service public : si vous avez des collègues d'Alsace/Moselle qui vous ignorent aujourd'hui, c'est normal...",public service announcement colleagues alsace moselle ignore today normal,0,0,0,0,0,0,0,0,0,2023.0,,0.238,0.762,0.0,-0.3612,neg
france,I'm a politics columnist for France’s leading newspaper Le Monde. AMA about France’s new pension reform. // Je suis chroniqueur politique au journal Le Monde. AMA sur la nouvelle réforme des retraites en France.,im politics columnist frances leading newspaper le monde ama frances new pension reform political columnist newspaper le monde ama new pension reform france,0,0,0,0,0,0,0,0,0,2023.0,,0.0,1.0,0.0,0.0,neu
france,Mon cousin du second degré m'a fait sa déclaration d'amour,second cousin made declaration love,0,0,0,0,0,0,0,0,0,2022.0,,0.0,0.488,0.512,0.6369,pos
france,Why are people protesting against age reforms?,people protesting age reforms,0,0,0,0,0,0,0,0,0,2023.0,,0.483,0.517,0.0,-0.4215,neg
france,"Hôpitaux de Paris: perte record attendue en 2023, retour à l'équilibre prévu en 2027",paris hospitals record loss expected 2023 return balance expected 2027,0,0,0,0,0,0,0,0,0,2023.0,,0.204,0.796,0.0,-0.3182,neg
france,La Maif créé le dividende écologique pour reverser chaque année 10 % de ses bénéfices à la planète,la maif creates ecological dividend donate 10 profits planet year,0,0,0,0,0,0,0,0,0,2023.0,,0.0,0.615,0.385,0.6124,pos
france,"Sea Shepherd France, Royaume-Uni et Brésil se séparent de l'organisation mère et fondent leur propre coalition",sea shepherd france uk brazil break away parent organization form coalition,0,0,0,0,0,0,0,0,0,2022.0,,0.0,1.0,0.0,0.0,neu
france,Live on minimum wage in Nice,live minimum wage nice,0,0,0,0,0,0,0,0,0,2023.0,,0.0,0.517,0.483,0.4215,pos
france,"[Digital Piracy] The rise of EMPRESS - How one woman turned the pirate underworld on its head, waged a solo war against the entire game industry (and won), went mad with power, started a messianic cult based on high school-level philosophy, and faked her own arrest to spite her rivals and haters",digital piracy rise empress one woman turned pirate underworld head waged solo war entire game industry went mad power started messianic cult based high schoollevel philosophy faked arrest spite rivals haters,0,0,0,0,0,0,0,0,0,2023.0,,0.382,0.618,0.0,-0.9442,neg
france,"""Hardest"" working countries (OC)",hardest working countries oc,0,0,0,0,0,0,0,0,0,2023.0,,0.0,1.0,0.0,0.0,neu
france,"Le « quiet quitting », cette « démission silencieuse » qui a tout d’une supercherie",quiet quitting silent resignation everything deception,0,0,0,0,0,0,0,0,0,2022.0,,0.56,0.44,0.0,-0.6249,neg
france,Internship with KEDGE Business School,internship kedge business school,0,0,0,0,0,0,0,0,0,2022.0,,0.0,1.0,0.0,0.0,neu
france,How much salary a PhD make after graduation?,much salary phd make graduation,0,0,0,0,0,0,0,0,0,2022.0,,0.0,1.0,0.0,0.0,neu
france,London to Paris? Help,london paris help,0,0,0,0,0,0,0,0,0,2022.0,,0.0,0.426,0.574,0.4019,pos
france,"How can I, as a British citizen, temporarily live and work in France?",british citizen temporarily live work france,0,0,0,0,0,0,0,0,0,2022.0,,0.0,1.0,0.0,0.0,neu
france,Immigration potential (from Poland to France),immigration potential poland france,0,0,0,0,0,0,0,0,0,2022.0,,0.0,1.0,0.0,0.0,neu
france,Paris activity with toilet nearby,paris activity toilet nearby,0,0,0,0,0,0,0,0,0,2022.0,,0.0,1.0,0.0,0.0,neu
