Subreddit,Original Title,Title,housing market,housing,property,real estate,construction,building,infrastructure,labor,wages,Created,Match,neg,neu,pos,compound,label
europe,Hamburg has become the first German city to pass a law allowing the seizure of empty commercial properties in order to house migrants,hamburg become first german city pass law allowing seizure empty commercial properties order house migrants,0,0,0,0,0,0,0,0,0,2015.0,,0.114,0.886,0.0,-0.2023,neg
europe,"Finnish government 'suspects Russia of buying property to house troops' in case of future invasion, tabloid claims",finnish government suspects russia buying property house troops case future invasion tabloid claims,0,0,1,0,0,0,0,0,0,2016.0,1.0,0.167,0.833,0.0,-0.34,neg
europe,"Private renters twice as likely as homeowners to have anxiety, UK study suggests | Renting property",private renters twice likely homeowners anxiety uk study suggests renting property,0,0,1,0,0,0,0,0,0,2022.0,1.0,0.145,0.855,0.0,-0.1779,neg
europe,Germany: Berlin locals vote to expropriate real estate giants,germany berlin locals vote expropriate real estate giants,0,0,0,1,0,0,0,0,0,2021.0,1.0,0.0,1.0,0.0,0.0,neu
europe,Non-EU citizens will need permission to buy real estate in Finland,noneu citizens need permission buy real estate finland,0,0,0,1,0,0,0,0,0,2019.0,1.0,0.0,1.0,0.0,0.0,neu
europe,Global Real Estate Bubble Index,global real estate bubble index,0,0,0,1,0,0,0,0,0,2020.0,1.0,0.0,1.0,0.0,0.0,neu
europe,Household net financial wealth(excluding real estate) in the OECD,household net financial wealth excluding real estate oecd,0,0,0,1,0,0,0,0,0,2018.0,1.0,0.0,0.686,0.314,0.4939,pos
europe,Team Navalny finds luxury real estate in Czech Republic belonging to family of Russian Tactical Missiles Corporation CEO,team navalny finds luxury real estate czech republic belonging family russian tactical missiles corporation ceo,0,0,0,1,0,0,0,0,0,2023.0,1.0,0.0,1.0,0.0,0.0,neu
europe,"Spain’s Balearic Islands propose a ban on non-resident foreign buyers. In 2021, the volume of real estate purchases by foreigners accounted for almost 40% of the market",spain balearic islands propose ban nonresident foreign buyers 2021 volume real estate purchases foreigners accounted almost 40 market,0,0,0,1,0,0,0,0,0,2023.0,1.0,0.175,0.825,0.0,-0.5574,neg
europe,"China owns vast network of UK real estate, offshore records reveal",china owns vast network uk real estate offshore records reveal,0,0,0,1,0,0,0,0,0,2023.0,1.0,0.0,1.0,0.0,0.0,neu
europe,Real Estate Speculation Has Made Lisbon One of the World’s Most Unlivable Cities,real estate speculation made lisbon one world unlivable cities,0,0,0,1,0,0,0,0,0,2022.0,1.0,0.0,1.0,0.0,0.0,neu
europe,Analysts are sounding alarm bell on European real estate stocks,analysts sounding alarm bell european real estate stocks,0,0,0,1,0,0,0,0,0,2023.0,1.0,0.255,0.745,0.0,-0.34,neg
europe,Fears mount that Europe’s commercial real estate sector could be the next to fall,fears mount europe commercial real estate sector could next fall,0,0,0,1,0,0,0,0,0,2023.0,1.0,0.237,0.763,0.0,-0.4215,neg
europe,The Louvre Pyramid under construction 1988. Workers built the pyramid before the supporting underground structure because they feared that if the Socialists lost their election in 1986 (they did) that conservatives would upend the entire project & wanted the designs to be irreversible.,louvre pyramid construction 1988 workers built pyramid supporting underground structure feared socialists lost election 1986 conservatives would upend entire project wanted designs irreversible,0,0,0,0,1,0,0,0,0,2023.0,1.0,0.25,0.651,0.099,-0.5267,neg
europe,"5th century Roman wall recently demolished by construction company in Albania, in Porto Romano, Durrës.",5th century roman wall recently demolished construction company albania porto romano durrës,0,0,0,0,1,0,0,0,0,2022.0,1.0,0.0,1.0,0.0,0.0,neu
europe,"In Turkey, the construction of Hetman Ivan Mazepa corvette for the Navy of Ukraine is completed. It will become part of Ukranian navy in 2024",turkey construction hetman ivan mazepa corvette navy ukraine completed become part ukranian navy 2024,0,0,0,0,1,0,0,0,0,2022.0,1.0,0.0,1.0,0.0,0.0,neu
europe,"Engineers from the UK and France meet during the construction of the channel tunnel, 1990",engineers uk france meet construction channel tunnel 1990,0,0,0,0,1,0,0,0,0,2021.0,1.0,0.0,1.0,0.0,0.0,neu
europe,Macron announces the construction of new EPR-type nuclear reactors,macron announces construction new eprtype nuclear reactors,0,0,0,0,1,0,0,0,0,2021.0,1.0,0.0,1.0,0.0,0.0,neu
europe,"27 August 1961 :Two weeks after the construction of the Berlin Wall, the Charlie checkpoint is the scene of a showdown between Americans and Soviets. For several hours, Soviet and American tanks, some tens of meters apart, face each other at the crossing point between East Berlin and West Berlin.",27 august 1961 two weeks construction berlin wall charlie checkpoint scene showdown americans soviets several hours soviet american tanks tens meters apart face crossing point east berlin west berlin,0,0,0,0,1,0,0,0,0,2018.0,1.0,0.0,1.0,0.0,0.0,neu
europe,New skyscraper under construction in Warsaw just caught fire,new skyscraper construction warsaw caught fire,0,0,0,0,1,0,0,0,0,2019.0,1.0,0.467,0.533,0.0,-0.3612,neg
europe,Outrage in Serbia after Chinese construction company destroys war monument,outrage serbia chinese construction company destroys war monument,0,0,0,0,1,0,0,0,0,2023.0,1.0,0.684,0.316,0.0,-0.8957,neg
europe,Highway construction in Romania (in km),highway construction romania km,0,0,0,0,1,0,0,0,0,2022.0,1.0,0.0,1.0,0.0,0.0,neu
europe,"Battleship Tirpitz 2022. 78 years after her sinking, her high quality armour plating is used in construction work all over Norway.",battleship tirpitz 2022 78 years sinking high quality armour plating used construction work norway,0,0,0,0,1,0,0,0,0,2022.0,1.0,0.078,0.922,0.0,-0.0258,neu
europe,The only building in the neighborhood that has not been collapsed is the Chamber of Civil Engineers building.,building neighborhood collapsed chamber civil engineers building,0,0,0,0,0,1,0,0,0,2023.0,1.0,0.259,0.741,0.0,-0.2732,neg
europe,Germany is building what's expected to become Europe's largest military,germany building whats expected become europes largest military,0,0,0,0,0,1,0,0,0,2022.0,1.0,0.0,1.0,0.0,0.0,neu
europe,Belgrade right now. An absolutely massive crowd is gathering in front of the parliament building for the anti-government protest.,belgrade right absolutely massive crowd gathering front parliament building antigovernment protest,0,0,0,0,0,1,0,0,0,2023.0,1.0,0.167,0.833,0.0,-0.25,neg
europe,German soldiers march in front of the Reichstag building to honor those who served in Afghanistan. 20 years Bundeswehr in the Hindu Kush. 20 years that have shaped Germany (and Europe),german soldiers march front reichstag building honor served afghanistan 20 years bundeswehr hindu kush 20 years shaped germany europe,0,0,0,0,0,1,0,0,0,2021.0,1.0,0.0,0.849,0.151,0.4939,pos
europe,"On this day in 1973, Francoist PM Luis Carrero Blanco was killed by Basque (ETA) terrorists who put a bomb under the road through which his car was passing. The car flew over a 5-story building and landed in its backyard, earning him the nickname of ""Spain's first astronaut"" (1st pic from a movie)",day 1973 francoist pm luis carrero blanco killed basque eta terrorists put bomb road car passing car flew 5story building landed backyard earning nickname spains first astronaut 1st pic movie,0,0,0,0,0,1,0,0,0,2021.0,1.0,0.304,0.696,0.0,-0.9153,neg
europe,"Protesters burn a flag outside the Russian government building in Moscow, March 31, 1999. Hundreds of Muscovites protested further air strikes against Yugoslavia by marching through the city's streets and singing hymns for their ""Slav brothers"" in Serbia",protesters burn flag outside russian government building moscow march 31 1999 hundreds muscovites protested air strikes yugoslavia marching citys streets singing hymns slav brothers serbia,0,0,0,0,0,1,0,0,0,2021.0,1.0,0.211,0.789,0.0,-0.5994,neg
europe,Poland building wall along border with Russia's Kaliningrad,poland building wall along border russias kaliningrad,0,0,0,0,0,1,0,0,0,2022.0,1.0,0.0,1.0,0.0,0.0,neu
europe,Europe’s new wall: Finland is building a 124-mile-long border fence to protect itself from Russia,europe new wall finland building 124milelong border fence protect russia,0,0,0,0,0,1,0,0,0,2023.0,1.0,0.0,0.776,0.224,0.3818,pos
europe,Pantsir-S1 air defense system under a green net on the building of the russian Ministry of Defense in Moscow,pantsirs1 air defense system green net building russian ministry defense moscow,0,0,0,0,0,1,0,0,0,2023.0,1.0,0.0,0.75,0.25,0.25,pos
europe,"Budapest, HU: Opposition representatives demand of screentime for their 5-point-list on the national TV channel failed during yesterday’s protest. The Rep’s were forcefully removed from the building, leaving their personal belongings behind. Meanwhile public TV casts irrelevant news to mask events.",budapest hu opposition representatives demand screentime 5pointlist national tv channel failed yesterday protest rep forcefully removed building leaving personal belongings behind meanwhile public tv casts irrelevant news mask events,0,0,0,0,0,1,0,0,0,2018.0,1.0,0.207,0.793,0.0,-0.7003,neg
europe,"Expel China from vital European infrastructure. The European Union must quickly pivot to a new, more prudent China policy",expel china vital european infrastructure european union must quickly pivot new prudent china policy,0,0,0,0,0,0,1,0,0,2022.0,1.0,0.17,0.702,0.129,-0.1779,neg
europe,Russia destroys power and water infrastructure across Ukraine,russia destroys power water infrastructure across ukraine,0,0,0,0,0,0,1,0,0,2022.0,1.0,0.375,0.625,0.0,-0.5574,neg
europe,Switzerland kicked out of European research infrastructure coordination body,switzerland kicked european research infrastructure coordination body,0,0,0,0,0,0,1,0,0,2023.0,1.0,0.0,1.0,0.0,0.0,neu
europe,EU hits back at Italy populists over Genoa bridge collapse: 'We gave you money to fix your infrastructure',eu hits back italy populists genoa bridge collapse gave money fix infrastructure,0,0,0,0,0,0,1,0,0,2018.0,1.0,0.225,0.775,0.0,-0.4939,neg
europe,Germany rethinks China’s Hamburg port deal as further doubts raised - New ministry report says terminal should have been deemed ‘critical infrastructure.’,germany rethinks china hamburg port deal doubts raised new ministry report says terminal deemed critical infrastructure,0,0,0,0,0,0,1,0,0,2023.0,1.0,0.243,0.757,0.0,-0.5423,neg
europe,Clear Sky Programme - Moscow has been moving its cable infrastructure underground,clear sky programme moscow moving cable infrastructure underground,0,0,0,0,0,0,1,0,0,2020.0,1.0,0.0,0.729,0.271,0.3818,pos
europe,"Russian hackers targeting Western critical infrastructure, UK says",russian hackers targeting western critical infrastructure uk says,0,0,0,0,0,0,1,0,0,2023.0,1.0,0.247,0.753,0.0,-0.3182,neg
europe,An elderly couple from Bakhmut sustained serious injuries after a Russian missile landed on their home. Putin increasingly targeting population centers and energy infrastructure,elderly couple bakhmut sustained serious injuries russian missile landed home putin increasingly targeting population centers energy infrastructure,0,0,0,0,0,0,1,0,0,2022.0,1.0,0.071,0.815,0.114,0.2023,pos
europe,"Germany is soft on Chinese spying. Huawei has deep ties to the Brijing government, but Berlin might let it build the country’s next generation of communication infrastructure anyway",germany soft chinese spying huawei deep ties brijing government berlin might let build country next generation communication infrastructure anyway,0,0,0,0,0,0,1,0,0,2018.0,1.0,0.0,1.0,0.0,0.0,neu
europe,"Ombudsman: German army is 'short of almost everything' - Minister of Defense Ursula von der Leyen intends to invest some 130 billion euros ($141 billion) in army infrastructure and equipment over the next 15 years, according to the news agencies.",ombudsman german army short almost everything minister defense ursula von der leyen intends invest 130 billion euros 141 billion army infrastructure equipment next 15 years according news agencies,0,0,0,0,0,0,1,0,0,2016.0,1.0,0.0,0.956,0.044,0.0609,pos
europe,"Sapri, Italy: statue dedicated to a farm laborer, symbol of the Italian Risorgimento (battle for independence) causes huge uproar because of its sexualised looks. Debate.",sapri italy statue dedicated farm laborer symbol italian risorgimento battle independence causes huge uproar sexualised looks debate,0,0,0,0,0,0,0,1,0,2021.0,1.0,0.119,0.639,0.242,0.4019,pos
europe,Russia plans to build 25 prisons and three forced labor camps in occupied areas of Ukraine,russia plans build 25 prisons three forced labor camps occupied areas ukraine,0,0,0,0,0,0,0,1,0,2023.0,1.0,0.214,0.786,0.0,-0.4588,neg
europe,Tax Burden on Labor in Europe,tax burden labor europe,0,0,0,0,0,0,0,1,0,2022.0,1.0,0.492,0.508,0.0,-0.4404,neg
europe,"Tesla Gigafactory Berlin in ‘total chaos,’ says worker in report about labor issues",tesla gigafactory berlin total chaos says worker report labor issues,0,0,0,0,0,0,0,1,0,2022.0,1.0,0.291,0.709,0.0,-0.5719,neg
europe,"Russian women recently liberated from a slave-labor camp by the U.S. Army lay flowers at the feet of four dead American soldiers (April 1945, Hilden Germany)",russian women recently liberated slavelabor camp u army lay flowers feet four dead american soldiers april 1945 hilden germany,0,0,0,0,0,0,0,1,0,2019.0,1.0,0.202,0.798,0.0,-0.6486,neg
europe,50 French Rappers will organize a solidarity concert to raise money for labor unions and workers on strike,50 french rappers organize solidarity concert raise money labor unions workers strike,0,0,0,0,0,0,0,1,0,2023.0,1.0,0.109,0.73,0.161,0.1779,pos
europe,"UK clamps down on Xinjiang labor camps, accusing China of ‘torture’ and ‘barbarism’",uk clamps xinjiang labor camps accusing china torture barbarism,0,0,0,0,0,0,0,1,0,2021.0,1.0,0.444,0.556,0.0,-0.6808,neg
europe,"""Germany finds that no more than 10% of refugees is usable on the labor market"" (Bart de Wever)",germany finds 10 refugees usable labor market bart de wever,0,0,0,0,0,0,0,1,0,2015.0,1.0,0.0,1.0,0.0,0.0,neu
europe,Russia's business tycoons have approached the country's ministry of labor suggesting it increases the working week to 6 days,russias business tycoons approached countrys ministry labor suggesting increases working week 6 days,0,0,0,0,0,0,0,1,0,2023.0,1.0,0.0,1.0,0.0,0.0,neu
europe,"China asks Spain, Netherlands to back EU deal after France and Poland threaten to block it over China's lack of commitment to end forced labor.",china asks spain netherlands back eu deal france poland threaten block chinas lack commitment end forced labor,0,0,0,0,0,0,0,1,0,2020.0,1.0,0.425,0.472,0.102,-0.802,neg
europe,Real Greek wages continue to fall since 2009,real greek wages continue fall since 2009,0,0,0,0,0,0,0,0,1,2023.0,1.0,0.0,1.0,0.0,0.0,neu
europe,Estimated fall in real wages.,estimated fall real wages,0,0,0,0,0,0,0,0,1,2023.0,1.0,0.0,1.0,0.0,0.0,neu
europe,Average net wage in Europe: 2013 vs 2021,average net wage europe 2013 vs 2021,0,0,0,0,0,0,0,0,0,2021.0,,0.0,1.0,0.0,0.0,neu
europe,Liters of gasoline you can buy with the average net monthly wage per country,liters gasoline buy average net monthly wage per country,0,0,0,0,0,0,0,0,0,2022.0,,0.0,1.0,0.0,0.0,neu
europe,Workers strike across Europe calling for higher wages amid rising inflation,workers strike across europe calling higher wages amid rising inflation,0,0,0,0,0,0,0,0,1,2022.0,1.0,0.143,0.857,0.0,-0.128,neg
europe,"2022 data on minimum wages in the EU: 13 countries had minimum wages below €1 000 per month: Bulgaria (€332), Latvia (€500), Romania (€515), Hungary (€542), Croatia (€624), Slovakia (€646), Czechia (€652), Estonia (€654), Poland (€655), Lithuania (€730), Greece (€774), Malta (€792) & Portugal (€823)",2022 data minimum wages eu 13 countries minimum wages 1 000 per month bulgaria 332 latvia 500 romania 515 hungary 542 croatia 624 slovakia 646 czechia 652 estonia 654 poland 655 lithuania 730 greece 774 malta 792 portugal 823,0,0,0,0,0,0,0,0,1,2022.0,1.0,0.0,1.0,0.0,0.0,neu
europe,Minimum wage in Europe (monthly),minimum wage europe monthly,0,0,0,0,0,0,0,0,0,2022.0,,0.0,1.0,0.0,0.0,neu
europe,"European nurses don't want to work for NHS, report suggests — Brexit-induced migratory hurdles and poor wages have made Britain an unattractive destination",european nurses dont want work nhs report suggests brexitinduced migratory hurdles poor wages made britain unattractive destination,0,0,0,0,0,0,0,0,1,2022.0,1.0,0.34,0.66,0.0,-0.7369,neg
europe,Average wages in Europe,average wages europe,0,0,0,0,0,0,0,0,1,2019.0,1.0,0.0,1.0,0.0,0.0,neu
europe,"Minimum wages, January 2016 (EUR per month)",minimum wages january 2016 eur per month,0,0,0,0,0,0,0,0,1,2016.0,1.0,0.0,1.0,0.0,0.0,neu
germany,"For anyone that lives near a military base; is the housing market being driven through the roof, due to greedy landlords asking for their max allowance? Found this local posting for a duplex...",anyone lives near military base housing market driven roof due greedy landlords asking max allowance found local posting duplex,1,1,0,0,0,0,0,0,0,2022.0,1.0,0.113,0.887,0.0,-0.3182,neg
germany,Questions about renting a home and housing market in medium-sized town,questions renting home housing market mediumsized town,1,1,0,0,0,0,0,0,0,2023.0,1.0,0.0,1.0,0.0,0.0,neu
germany,Moving to Munich from the USA - Housing Market and COL,moving munich usa housing market col,1,1,0,0,0,0,0,0,0,2022.0,1.0,0.0,1.0,0.0,0.0,neu
germany,Why isn't the German government taking steps to ease housing crisis?,isnt german government taking steps ease housing crisis,0,1,0,0,0,0,0,0,0,2022.0,1.0,0.325,0.476,0.198,-0.3818,neg
germany,[D] Is the German housing market a bubble?,german housing market bubble,1,1,0,0,0,0,0,0,0,2017.0,1.0,0.0,1.0,0.0,0.0,neu
germany,Is it true that the rental culture and renter’s rights are very strong in Germany to the point that most Germans prefer renting than owning properties?,true rental culture renter rights strong germany point germans prefer renting owning properties,0,0,0,0,0,0,0,0,0,2023.0,,0.0,0.643,0.357,0.7269,pos
germany,Any advice how to get really REALLY good in the German language and understand their habits?,advice get really really good german language understand habits,0,0,0,0,0,0,0,0,0,2021.0,,0.0,0.697,0.303,0.5379,pos
germany,"Immigration: Working in Germany, Living in Switzerland",immigration working germany living switzerland,0,0,0,0,0,0,0,0,0,2023.0,,0.0,1.0,0.0,0.0,neu
germany,How not to feel bad abt Mietpreisbremse,feel bad abt mietpreisbremse,0,0,0,0,0,0,0,0,0,2023.0,,0.538,0.462,0.0,-0.5423,neg
germany,Which city would you pick if you could work remotely?,city would pick could work remotely,0,0,0,0,0,0,0,0,0,2023.0,,0.0,1.0,0.0,0.0,neu
germany,Germany Faces Record Shortage of Affordable Housing,germany faces record shortage affordable housing,0,1,0,0,0,0,0,0,0,2023.0,1.0,0.286,0.714,0.0,-0.25,neg
germany,"For anyone that lives near a military base; is the housing market being driven through the roof, due to greedy landlords asking for their max allowance? Found this local posting for a duplex...",anyone lives near military base housing market driven roof due greedy landlords asking max allowance found local posting duplex,1,1,0,0,0,0,0,0,0,2022.0,1.0,0.113,0.887,0.0,-0.3182,neg
germany,Fuggerei. World's oldest housing complex. Augsburg.,fuggerei worlds oldest housing complex augsburg,0,1,0,0,0,0,0,0,0,2022.0,1.0,0.0,1.0,0.0,0.0,neu
germany,Why isn't the German government taking steps to ease housing crisis?,isnt german government taking steps ease housing crisis,0,1,0,0,0,0,0,0,0,2022.0,1.0,0.325,0.476,0.198,-0.3818,neg
germany,My dad found this in an old German house in Memel (now Klaipėda). Any idea what’s this brand or what even is this? Brandy? Thanks in advance!,dad found old german house memel klaipėda idea brand even brandy thanks advance,0,0,0,0,0,0,0,0,0,2022.0,,0.0,0.805,0.195,0.4404,pos
germany,"Is there any wild life control Organisation in Germany? This racoon comes to my friends house everyday and I've noticed he is in poor condition.He might spread disease to people . I live in Leipzig , thanks in advance .",wild life control organisation germany racoon comes friends house everyday ive noticed poor condition might spread disease people live leipzig thanks advance,0,0,0,0,0,0,0,0,0,2023.0,,0.11,0.676,0.214,0.4404,pos
germany,"A abandoned house in Colmberg, Bayern. Why are the flags there and ""LIE"" written in the wall?",abandoned house colmberg bayern flags lie written wall,0,0,0,0,0,0,0,0,0,2022.0,,0.3,0.7,0.0,-0.4588,neg
germany,Why do houses in Northern Germany often have these ultra-large roofes?,houses northern germany often ultralarge roofes,0,0,0,0,0,0,0,0,0,2022.0,,0.0,1.0,0.0,0.0,neu
germany,Is it normal that kids throw eggs at your house on Halloween?,normal kids throw eggs house halloween,0,0,0,0,0,0,0,0,0,2022.0,,0.0,1.0,0.0,0.0,neu
germany,How do you guys deal with the giant house spiders?,guys deal giant house spiders,0,0,0,0,0,0,0,0,0,2022.0,,0.0,1.0,0.0,0.0,neu
germany,Is it true that the rental culture and renter’s rights are very strong in Germany to the point that most Germans prefer renting than owning properties?,true rental culture renter rights strong germany point germans prefer renting owning properties,0,0,0,0,0,0,0,0,0,2023.0,,0.0,0.643,0.357,0.7269,pos
germany,Is it a mistake to buy a property at this moment with the high interest rate?,mistake buy property moment high interest rate,0,0,1,0,0,0,0,0,0,2023.0,1.0,0.231,0.481,0.288,0.1531,pos
germany,How do even people buy properties in Germany?,even people buy properties germany,0,0,0,0,0,0,0,0,0,2022.0,,0.0,1.0,0.0,0.0,neu
germany,Are you allowed to have a video camera on your property that is also filming the sideways?,allowed video camera property also filming sideways,0,0,1,0,0,0,0,0,0,2022.0,1.0,0.0,1.0,0.0,0.0,neu
germany,Who buys the 10M+ EUR properties in Munich?,buys 10m eur properties munich,0,0,0,0,0,0,0,0,0,2023.0,,0.0,1.0,0.0,0.0,neu
germany,Can you get a cash reward for handing in lost property to the police (in Berlin) ?,get cash reward handing lost property police berlin,0,0,1,0,0,0,0,0,0,2023.0,1.0,0.192,0.5,0.308,0.34,pos
germany,Wasp nest on private property,wasp nest private property,0,0,1,0,0,0,0,0,0,2023.0,1.0,0.0,1.0,0.0,0.0,neu
germany,Property Rental Scams in Germnay,property rental scams germnay,0,0,1,0,0,0,0,0,0,2023.0,1.0,0.559,0.441,0.0,-0.5859,neg
germany,Is it legal to invite your friends to camp on your private property?,legal invite friends camp private property,0,0,1,0,0,0,0,0,0,2022.0,1.0,0.0,0.326,0.674,0.6369,pos
germany,How can I check who owns a certain property?,check owns certain property,0,0,1,0,0,0,0,0,0,2023.0,1.0,0.0,0.588,0.412,0.2732,pos
germany,I don't get the real estate prices in Munich,dont get real estate prices munich,0,0,0,1,0,0,0,0,0,2022.0,1.0,0.0,1.0,0.0,0.0,neu
germany,Real estate in munich?,real estate munich,0,0,0,1,0,0,0,0,0,2023.0,1.0,0.0,1.0,0.0,0.0,neu
germany,How do i find who owns the Real Estate Company to which I pay rent?,find owns real estate company pay rent,0,0,0,1,0,0,0,0,0,2023.0,1.0,0.189,0.811,0.0,-0.1027,neg
germany,Will USA real estate transactions and investments allow me to get a residence visa in Germany ?,usa real estate transactions investments allow get residence visa germany,0,0,0,1,0,0,0,0,0,2023.0,1.0,0.0,0.826,0.174,0.2263,pos
germany,Is the game of real estate destroying affordable housing?,game real estate destroying affordable housing,0,1,0,1,0,0,0,0,0,2023.0,1.0,0.419,0.581,0.0,-0.5574,neg
germany,Real estate in Germany,real estate germany,0,0,0,1,0,0,0,0,0,2023.0,1.0,0.0,1.0,0.0,0.0,neu
germany,Problems with real estate agency TAG,problems real estate agency tag,0,0,0,1,0,0,0,0,0,2023.0,1.0,0.403,0.597,0.0,-0.4019,neg
germany,Germany real estate?,germany real estate,0,0,0,1,0,0,0,0,0,2023.0,1.0,0.0,1.0,0.0,0.0,neu
germany,Why Germans prefer not to buy Real Estate properties ?,germans prefer buy real estate properties,0,0,0,1,0,0,0,0,0,2022.0,1.0,0.0,1.0,0.0,0.0,neu
germany,Best Real Estate Rental/Sale Website for Germany in English,best real estate rental sale website germany english,0,0,0,1,0,0,0,0,0,2023.0,1.0,0.0,0.625,0.375,0.6369,pos
germany,"Aachen Cathedral, Germany. Constructed by order of King Karl the Great. Built in the year 796, it is one of the oldest cathedrals in Europe.",aachen cathedral germany constructed order king karl great built year 796 one oldest cathedrals europe,0,0,0,0,0,0,0,0,0,2022.0,,0.0,0.773,0.227,0.6249,pos
germany,Construction noise regulation?,construction noise regulation,0,0,0,0,1,0,0,0,0,2023.0,1.0,0.0,1.0,0.0,0.0,neu
germany,Building construction year,building construction year,0,0,0,0,1,1,0,0,0,2023.0,1.0,0.0,1.0,0.0,0.0,neu
germany,Speeding ticket construction work,speeding ticket construction work,0,0,0,0,1,0,0,0,0,2023.0,1.0,0.0,1.0,0.0,0.0,neu
germany,When the construction workers really hate you,construction workers really hate,0,0,0,0,1,0,0,0,0,2022.0,1.0,0.571,0.429,0.0,-0.6115,neg
germany,Berlin construction,berlin construction,0,0,0,0,1,0,0,0,0,2023.0,1.0,0.0,1.0,0.0,0.0,neu
germany,"Foreigners or Germans who work in construction, do you need a German certificate to get a construction job? How difficult is it to get hired for this type of work as a foreigner?",foreigners germans work construction need german certificate get construction job difficult get hired type work foreigner,0,0,0,0,1,0,0,0,0,2023.0,1.0,0.143,0.857,0.0,-0.3612,neg
